{"$schema": "http://json-schema.org/schema#", "type": "object", "properties": {"id": {"type": "string"}, "title": {"type": "string"}, "formats": {"type": "array", "items": {"type": "object", "properties": {"asr": {"type": ["integer", "null"]}, "filesize": {"type": "integer"}, "format_id": {"type": "string"}, "format_note": {"type": "string"}, "source_preference": {"type": "integer"}, "fps": {"type": ["null", "number"]}, "audio_channels": {"type": ["integer", "null"]}, "height": {"type": ["integer", "null"]}, "quality": {"type": "number"}, "has_drm": {"type": "boolean"}, "tbr": {"type": "number"}, "filesize_approx": {"type": "integer"}, "url": {"type": "string"}, "width": {"type": ["integer", "null"]}, "language": {"type": "null"}, "language_preference": {"type": "integer"}, "preference": {"type": "null"}, "ext": {"type": "string"}, "vcodec": {"type": "string"}, "acodec": {"type": "string"}, "dynamic_range": {"type": "null"}, "available_at": {"type": "integer"}, "downloader_options": {"type": "object", "properties": {"http_chunk_size": {"type": "integer"}}, "required": ["http_chunk_size"]}, "container": {"type": "string"}, "format_index": {"type": "null"}, "manifest_url": {"type": "string"}, "protocol": {"type": "string"}}, "required": ["acodec", "available_at", "dynamic_range", "ext", "format_id", "fps", "has_drm", "height", "preference", "quality", "source_preference", "tbr", "url", "vcodec", "width"]}}, "thumbnails": {"type": "array", "items": {"type": "object", "properties": {"url": {"type": "string"}, "height": {"type": "integer"}, "width": {"type": "integer"}, "preference": {"type": "integer"}}, "required": ["preference", "url"]}}, "thumbnail": {"type": "string"}, "description": {"type": "string"}, "channel_id": {"type": "string"}, "channel_url": {"type": "string"}, "duration": {"type": "integer"}, "view_count": {"type": "integer"}, "average_rating": {"type": "null"}, "age_limit": {"type": "integer"}, "webpage_url": {"type": "string"}, "categories": {"type": "array", "items": {"type": "string"}}, "tags": {"type": "array", "items": {"type": "string"}}, "playable_in_embed": {"type": "boolean"}, "live_status": {"type": "string"}, "media_type": {"type": "string"}, "release_timestamp": {"type": "null"}, "_format_sort_fields": {"type": "array", "items": {"type": "string"}}, "automatic_captions": {"type": "object", "properties": {"en": {"type": "array", "items": {"type": "object", "properties": {"url": {"type": "string"}, "ext": {"type": "string"}, "protocol": {"type": "string"}, "__yt_dlp_client": {"type": "string"}}, "required": ["__yt_dlp_client", "ext", "protocol", "url"]}}, "de": {"type": "array", "items": {"type": "object", "properties": {"url": {"type": "string"}, "ext": {"type": "string"}, "protocol": {"type": "string"}, "__yt_dlp_client": {"type": "string"}}, "required": ["__yt_dlp_client", "ext", "protocol", "url"]}}}, "required": ["de", "en"]}, "subtitles": {"type": "object", "properties": {"en": {"type": "array", "items": {"type": "object", "properties": {"ext": {"type": "string"}, "url": {"type": "string"}, "name": {"type": "string"}, "impersonate": {"type": "boolean"}, "__yt_dlp_client": {"type": "string"}}, "required": ["__yt_dlp_client", "ext", "impersonate", "name", "url"]}}, "de": {"type": "array", "items": {"type": "object", "properties": {"ext": {"type": "string"}, "url": {"type": "string"}, "name": {"type": "string"}, "impersonate": {"type": "boolean"}, "__yt_dlp_client": {"type": "string"}}, "required": ["__yt_dlp_client", "ext", "impersonate", "name", "url"]}}}, "required": ["de", "en"]}, "comment_count": {"type": "integer"}, "chapters": {"type": "array", "items": {"type": "object", "properties": {"start_time": {"type": "number"}, "title": {"type": "string"}}, "required": ["start_time", "title"]}}, "heatmap": {"type": "array", "items": {"type": "object", "properties": {"start_time": {"type": "number"}, "end_time": {"type": "number"}, "value": {"type": "number"}}, "required": ["end_time", "start_time", "value"]}}, "location": {"type": "string"}, "like_count": {"type": "integer"}, "channel": {"type": "string"}, "channel_follower_count": {"type": "integer"}, "channel_is_verified": {"type": "boolean"}, "uploader": {"type": "string"}, "uploader_id": {"type": "string"}, "uploader_url": {"type": "string"}, "upload_date": {"type": "string"}, "timestamp": {"type": "integer"}, "availability": {"type": "string"}, "__post_extractor": {"type": "null"}, "original_url": {"type": "string"}, "webpage_url_basename": {"type": "string"}, "webpage_url_domain": {"type": "string"}, "extractor": {"type": "string"}, "extractor_key": {"type": "string"}, "epoch": {"type": "integer"}, "_type": {"type": "string"}, "_version": {"type": "object", "properties": {"version": {"type": "string"}, "current_git_head": {"type": "null"}, "release_git_head": {"type": "string"}, "repository": {"type": "string"}}, "required": ["current_git_head", "release_git_head", "repository", "version"]}}, "required": ["__post_extractor", "_format_sort_fields", "_type", "_version", "age_limit", "automatic_captions", "availability", "average_rating", "categories", "channel", "channel_follower_count", "channel_id", "channel_is_verified", "channel_url", "chapters", "comment_count", "description", "duration", "epoch", "extractor", "extractor_key", "formats", "heatmap", "id", "like_count", "live_status", "location", "media_type", "original_url", "playable_in_embed", "release_timestamp", "subtitles", "tags", "thumbnail", "thumbnails", "timestamp", "title", "upload_date", "uploader", "uploader_id", "uploader_url", "view_count", "webpage_url", "webpage_url_basename", "webpage_url_domain"]}
