{
  "id": "jNQXAC9IVRw",
  "title": "Me at the zoo",
  "formats": [
    {
      "asr": 44100,
      "filesize": 791367,
      "format_id": "18",
      "format_note": "240p",
      "source_preference": -1,
      "fps": 15,
      "audio_channels": 1,
      "height": 240,
      "quality": 5.0,
      "has_drm": false,
      "tbr": 332.105,
      "filesize_approx": 791364,
      "url": "https://rr1---sn-n4v7sney.googlevideo.com/videoplayback?expire=1758999516&ei=fN_XaJL2BfGty_sP94OyuQc&ip=107.204.173.81&id=o-ABpum7n35USM_9BPUowOZklfFhR1o5GSIcGjKf-k4QKT&itag=18&source=youtube&requiressl=yes&xpc=EgVo2aDSNQ%3D%3D&cps=436&met=1758977916%2C&mh=VD&mm=31%2C29&mn=sn-n4v7sney%2Csn-o097znzk&ms=au%2Crdu&mv=m&mvi=1&pl=21&rms=au%2Cau&initcwndbps=1950000&bui=ATw7iSV9iKGFWbmwZS3OYIHMsffmzuuX7FdQ1_yTyt2ENAIylW6RozMvc95XRhOA6F8EbnV7TFOZIr4l&vprv=1&svpuc=1&mime=video%2Fmp4&ns=giEMj9abzCZzqhA5YRRkjF0Q&rqh=1&gir=yes&clen=791367&ratebypass=yes&dur=19.063&lmt=1680501259475484&mt=1758977378&fvip=3&lmw=1&fexp=51565116%2C51565682%2C51580970&c=TVHTML5&sefc=1&txp=4530434&n=ccPCnIl4TLBDtg&sparams=expire%2Cei%2Cip%2Cid%2Citag%2Csource%2Crequiressl%2Cxpc%2Cbui%2Cvprv%2Csvpuc%2Cmime%2Cns%2Crqh%2Cgir%2Cclen%2Cratebypass%2Cdur%2Clmt&sig=AJfQdSswRQIhANie0Ej62AO2vFO2LKAKaBeylbuK_TWS8bPZ5Inn-cdzAiBaMLu3xTTbYEw2HXXTsle1YiG3KxGS33ElhgXkTgbFZQ%3D%3D&lsparams=cps%2Cmet%2Cmh%2Cmm%2Cmn%2Cms%2Cmv%2Cmvi%2Cpl%2Crms%2Cinitcwndbps&lsig=APaTxxMwRQIgTaMJq0BMo3iQLNoYRVw4IdUm4tSMBn9Xj39In2gjY2ACIQDrPF-PNGlT8VooPnbqxQ4wsN1-G-0Io6SFo5SRQyhl2g%3D%3D",
      "width": 320,
      "language": null,
      "language_preference": -1,
      "preference": null,
      "ext": "mp4",
      "vcodec": "avc1.42001E",
      "acodec": "mp4a.40.2",
      "dynamic_range": null,
      "available_at": 1758977922,
      "downloader_options": {
        "http_chunk_size": 10485760
      }
    },
    {
      "asr": null,
      "filesize": 432799,
      "format_id": "133",
      "format_note": "240p",
      "source_preference": -1,
      "fps": 15,
      "audio_channels": null,
      "height": 240,
      "quality": 5.0,
      "has_drm": false,
      "tbr": 182.876,
      "filesize_approx": 432798,
      "url": "https://rr1---sn-n4v7sney.googlevideo.com/videoplayback?expire=1758999516&ei=fN_XaJL2BfGty_sP94OyuQc&ip=107.204.173.81&id=o-ABpum7n35USM_9BPUowOZklfFhR1o5GSIcGjKf-k4QKT&itag=133&aitags=133%2C160%2C242%2C278%2C394%2C395&source=youtube&requiressl=yes&xpc=EgVo2aDSNQ%3D%3D&cps=436&met=1758977916%2C&mh=VD&mm=31%2C29&mn=sn-n4v7sney%2Csn-o097znzk&ms=au%2Crdu&mv=m&mvi=1&pl=21&rms=au%2Cau&initcwndbps=1950000&bui=ATw7iSXw0zRJMkHYEW8UvIrmQVpPI24BnW8V2s8Vkx5mdtOGY34sIWQM4xwoETS_PLztQKVhd8PVhaON&vprv=1&svpuc=1&mime=video%2Fmp4&ns=AzY7VPs9Cet4sgaZLlB1YWEQ&rqh=1&gir=yes&clen=432799&dur=18.933&lmt=1680501288781393&mt=1758977378&fvip=3&keepalive=yes&lmw=1&fexp=51565116%2C51565682%2C51580970&c=TVHTML5&sefc=1&txp=4530434&n=k7BXkZ4bQEG9Ig&sparams=expire%2Cei%2Cip%2Cid%2Caitags%2Csource%2Crequiressl%2Cxpc%2Cbui%2Cvprv%2Csvpuc%2Cmime%2Cns%2Crqh%2Cgir%2Cclen%2Cdur%2Clmt&sig=AJfQdSswRgIhANIXk6aynMblFSZlqNUs6dRzVCjLSyO_yDpf6P7NFS_vAiEAo5RpzlJpJlw1SAhPVj9W2dVxdWkEqU8DCTEq0YrvyWo%3D&lsparams=cps%2Cmet%2Cmh%2Cmm%2Cmn%2Cms%2Cmv%2Cmvi%2Cpl%2Crms%2Cinitcwndbps&lsig=APaTxxMwRQIgTaMJq0BMo3iQLNoYRVw4IdUm4tSMBn9Xj39In2gjY2ACIQDrPF-PNGlT8VooPnbqxQ4wsN1-G-0Io6SFo5SRQyhl2g%3D%3D",
      "width": 320,
      "language": null,
      "language_preference": -1,
      "preference": null,
      "ext": "mp4",
      "vcodec": "avc1.4d400c",
      "acodec": "none",
      "dynamic_range": null,
      "container": "mp4_dash",
      "available_at": 1758977922,
      "downloader_options": {
        "http_chunk_size": 10485760
      }
    },
    {
      "asr": null,
      "filesize": 293080,
      "format_id": "242",
      "format_note": "240p",
      "source_preference": -1,
      "fps": 15,
      "audio_channels": null,
      "height": 240,
      "quality": 5.0,
      "has_drm": false,
      "tbr": 123.838,
      "filesize_approx": 293078,
      "url": "https://rr1---sn-n4v7sney.googlevideo.com/videoplayback?expire=1758999516&ei=fN_XaJL2BfGty_sP94OyuQc&ip=107.204.173.81&id=o-ABpum7n35USM_9BPUowOZklfFhR1o5GSIcGjKf-k4QKT&itag=242&aitags=133%2C160%2C242%2C278%2C394%2C395&source=youtube&requiressl=yes&xpc=EgVo2aDSNQ%3D%3D&cps=436&met=1758977916%2C&mh=VD&mm=31%2C29&mn=sn-n4v7sney%2Csn-o097znzk&ms=au%2Crdu&mv=m&mvi=1&pl=21&rms=au%2Cau&initcwndbps=1950000&bui=ATw7iSXw0zRJMkHYEW8UvIrmQVpPI24BnW8V2s8Vkx5mdtOGY34sIWQM4xwoETS_PLztQKVhd8PVhaON&vprv=1&svpuc=1&mime=video%2Fwebm&ns=AzY7VPs9Cet4sgaZLlB1YWEQ&rqh=1&gir=yes&clen=293080&dur=18.933&lmt=1680501309294787&mt=1758977378&fvip=3&keepalive=yes&lmw=1&fexp=51565116%2C51565682%2C51580970&c=TVHTML5&sefc=1&txp=4530434&n=k7BXkZ4bQEG9Ig&sparams=expire%2Cei%2Cip%2Cid%2Caitags%2Csource%2Crequiressl%2Cxpc%2Cbui%2Cvprv%2Csvpuc%2Cmime%2Cns%2Crqh%2Cgir%2Cclen%2Cdur%2Clmt&sig=AJfQdSswRQIgCaCI9_HUb4B4ZUYd-Vt5Ufwm8zKOj3gSSMaSFGRWC-cCIQDOWt0opKOi-qNTS-7kJzZNWR4UowX3ozPiLshtc0s8SQ%3D%3D&lsparams=cps%2Cmet%2Cmh%2Cmm%2Cmn%2Cms%2Cmv%2Cmvi%2Cpl%2Crms%2Cinitcwndbps&lsig=APaTxxMwRQIgTaMJq0BMo3iQLNoYRVw4IdUm4tSMBn9Xj39In2gjY2ACIQDrPF-PNGlT8VooPnbqxQ4wsN1-G-0Io6SFo5SRQyhl2g%3D%3D",
      "width": 320,
      "language": null,
      "language_preference": -1,
      "preference": null,
      "ext": "webm",
      "vcodec": "vp9",
      "acodec": "none",
      "dynamic_range": null,
      "container": "webm_dash",
      "available_at": 1758977922,
      "downloader_options": {
        "http_chunk_size": 10485760
      }
    },
    {
      "asr": null,
      "filesize": 258472,
      "format_id": "395",
      "format_note": "240p",
      "source_preference": -1,
      "fps": 15,
      "audio_channels": null,
      "height": 240,
      "quality": 5.0,
      "has_drm": false,
      "tbr": 109.215,
      "filesize_approx": 258470,
      "url": "https://rr1---sn-n4v7sney.googlevideo.com/videoplayback?expire=1758999516&ei=fN_XaJL2BfGty_sP94OyuQc&ip=107.204.173.81&id=o-ABpum7n35USM_9BPUowOZklfFhR1o5GSIcGjKf-k4QKT&itag=395&aitags=133%2C160%2C242%2C278%2C394%2C395&source=youtube&requiressl=yes&xpc=EgVo2aDSNQ%3D%3D&cps=436&met=1758977916%2C&mh=VD&mm=31%2C29&mn=sn-n4v7sney%2Csn-o097znzk&ms=au%2Crdu&mv=m&mvi=1&pl=21&rms=au%2Cau&initcwndbps=1950000&bui=ATw7iSXw0zRJMkHYEW8UvIrmQVpPI24BnW8V2s8Vkx5mdtOGY34sIWQM4xwoETS_PLztQKVhd8PVhaON&vprv=1&svpuc=1&mime=video%2Fmp4&ns=AzY7VPs9Cet4sgaZLlB1YWEQ&rqh=1&gir=yes&clen=258472&dur=18.933&lmt=1680501372905765&mt=1758977378&fvip=3&keepalive=yes&lmw=1&fexp=51565116%2C51565682%2C51580970&c=TVHTML5&sefc=1&txp=4530434&n=k7BXkZ4bQEG9Ig&sparams=expire%2Cei%2Cip%2Cid%2Caitags%2Csource%2Crequiressl%2Cxpc%2Cbui%2Cvprv%2Csvpuc%2Cmime%2Cns%2Crqh%2Cgir%2Cclen%2Cdur%2Clmt&sig=AJfQdSswRgIhAORRQReAKl616M1qZoDFHtZl03Q2vLqbPqrG2NsqIhwHAiEAxIeT60bqbHzP5KmX2I1HxBjZFbSSrzs57DZV2VVzwpA%3D&lsparams=cps%2Cmet%2Cmh%2Cmm%2Cmn%2Cms%2Cmv%2Cmvi%2Cpl%2Crms%2Cinitcwndbps&lsig=APaTxxMwRQIgTaMJq0BMo3iQLNoYRVw4IdUm4tSMBn9Xj39In2gjY2ACIQDrPF-PNGlT8VooPnbqxQ4wsN1-G-0Io6SFo5SRQyhl2g%3D%3D",
      "width": 320,
      "language": null,
      "language_preference": -1,
      "preference": null,
      "ext": "mp4",
      "vcodec": "av01.0.00M.08.0.110.05.01.06.0",
      "acodec": "none",
      "dynamic_range": null,
      "container": "mp4_dash",
      "available_at": 1758977922,
      "downloader_options": {
        "http_chunk_size": 10485760
      }
    },
    {
      "asr": null,
      "filesize": 195132,
      "format_id": "160",
      "format_note": "144p",
      "source_preference": -1,
      "fps": 15,
      "audio_channels": null,
      "height": 144,
      "quality": 0.0,
      "has_drm": false,
      "tbr": 82.451,
      "filesize_approx": 195130,
      "url": "https://rr1---sn-n4v7sney.googlevideo.com/videoplayback?expire=1758999516&ei=fN_XaJL2BfGty_sP94OyuQc&ip=107.204.173.81&id=o-ABpum7n35USM_9BPUowOZklfFhR1o5GSIcGjKf-k4QKT&itag=160&aitags=133%2C160%2C242%2C278%2C394%2C395&source=youtube&requiressl=yes&xpc=EgVo2aDSNQ%3D%3D&cps=436&met=1758977916%2C&mh=VD&mm=31%2C29&mn=sn-n4v7sney%2Csn-o097znzk&ms=au%2Crdu&mv=m&mvi=1&pl=21&rms=au%2Cau&initcwndbps=1950000&bui=ATw7iSXw0zRJMkHYEW8UvIrmQVpPI24BnW8V2s8Vkx5mdtOGY34sIWQM4xwoETS_PLztQKVhd8PVhaON&vprv=1&svpuc=1&mime=video%2Fmp4&ns=AzY7VPs9Cet4sgaZLlB1YWEQ&rqh=1&gir=yes&clen=195132&dur=18.933&lmt=1680501287522448&mt=1758977378&fvip=3&keepalive=yes&lmw=1&fexp=51565116%2C51565682%2C51580970&c=TVHTML5&sefc=1&txp=4530434&n=k7BXkZ4bQEG9Ig&sparams=expire%2Cei%2Cip%2Cid%2Caitags%2Csource%2Crequiressl%2Cxpc%2Cbui%2Cvprv%2Csvpuc%2Cmime%2Cns%2Crqh%2Cgir%2Cclen%2Cdur%2Clmt&sig=AJfQdSswRAIgJRAHJC1mWMa8ACdnfd0WVMuDKGPbm4HC4gGM6eJxJKgCIGKphgF5Zzk-KOwKoyGeWumWJHpLFWr8MtyHib_3Exly&lsparams=cps%2Cmet%2Cmh%2Cmm%2Cmn%2Cms%2Cmv%2Cmvi%2Cpl%2Crms%2Cinitcwndbps&lsig=APaTxxMwRQIgTaMJq0BMo3iQLNoYRVw4IdUm4tSMBn9Xj39In2gjY2ACIQDrPF-PNGlT8VooPnbqxQ4wsN1-G-0Io6SFo5SRQyhl2g%3D%3D",
      "width": 192,
      "language": null,
      "language_preference": -1,
      "preference": null,
      "ext": "mp4",
      "vcodec": "avc1.4d400b",
      "acodec": "none",
      "dynamic_range": null,
      "container": "mp4_dash",
      "available_at": 1758977922,
      "downloader_options": {
        "http_chunk_size": 10485760
      }
    },
    {
      "asr": null,
      "filesize": 185292,
      "format_id": "278",
      "format_note": "144p",
      "source_preference": -1,
      "fps": 15,
      "audio_channels": null,
      "height": 144,
      "quality": 0.0,
      "has_drm": false,
      "tbr": 78.293,
      "filesize_approx": 185290,